id,tokens,intent
423,which flight is a one way fare at 329 dollars from denver to pittsburgh,Flight
2301,what is the first flight from atlanta to boston on thursday september fifth that leaves after 8 am,Flight
4295,i want to fly from kansas city to chicago next wednesday arriving in the evening and returning the next day,Flight
426,show me all fares between philadelphia and san francisco that are less than 200 dollars one way,Flight
2428,please find the earliest possible flight from boston to denver,Flight
4790,show flights from denver to san francisco,Flight
69,what are the flights available between 10 am and 3 pm between pittsburgh and fort worth,Flight
3514,chicago to san francisco on continental,Flight
4174,need a flight from pittsburgh to denver,Flight
1209,is there a plane from boston to washington,Flight
5526,i 'd like the cheapest round trip ticket from Minneapolis to San Diego arriving in San Diego before seven p.m .,Flight
499,i'd like to fly from san francisco to boston with a stopover in dallas fort worth and i want to fly on delta airlines,Flight
2899,list the flights from denver to westchester county on june seventh,Flight
4960,what is the earliest flight leaving denver and arriving in baltimore on united airlines first class on july fourth,Flight
4410,ground san francisco,NoFlight
5487,find a flight from Washington D C to Milwaukee .,Flight
1316,what is the earliest flight from tampa to milwaukee tomorrow,Flight
2891,what flights are available between baltimore and boston on august twelfth,Flight
1743,what airlines fly into salt lake city,NoFlight
5465,are any fares cheaper than these .,Flight
2741,show me one way flights from milwaukee to orlando wednesday,Flight
3016,i would like to fly from baltimore to san francisco on eastern airlines,Flight
1562,show all flights from boston to denver on july thirty first,Flight
4600,is there a flight around 3 pm from charlotte to minneapolis,Flight
705,show me times for coach flights between boston and baltimore on wednesday,Flight
601,flights from newark to cleveland 5 o'clock pm daily,Flight
5457,list those flights that stop over in Salt Lake City .,Flight
3648,on monday show me flights from baltimore to dallas,Flight
1543,what is your last trip from washington to boston on august twenty seventh,Flight
4278,show me all flights from atlanta to san francisco which leave the day after tomorrow after 5 o'clock pm,Flight
1521,list flights from houston to memphis june twenty ninth,Flight
5515,how much is the bus fare from San Francisco to downtown .,NoFlight
4165,show me the flights from baltimore to oakland,Flight
3102,does american airlines fly from atlanta to philadelphia,Flight
3995,show me all the flights from montreal to detroit,Flight
4839,show me flights from baltimore to dallas,Flight
4372,show me the continental flights leaving chicago early saturday morning,Flight
2806,is there a flight from atlanta to san francisco on november seventh at noon,Flight
3290,what am flights are available from pittsburgh to boston,Flight
2551,what is the cheapest one way ticket from denver to pittsburgh,Flight
131,tell me about flights from atlanta to charlotte north carolina leaving on monday and arriving in charlotte,Flight
5210,what is the cheapest way to fly from denver to oakland,Flight
5324,please list the flights from new york to miami on a tuesday,Flight
3098,show me saturday and sunday's flights from milwaukee to phoenix on american airlines,Flight
2138,i'd like to fly from philadelphia to san francisco through dallas,Flight
286,what is the arrival time in san francisco for the 755 am flight leaving washington,Flight
241,how much is a limousine service in la guardia,NoFlight
4160,i would like to fly from philadelphia to dallas,Flight
3046,i would like to fly from pittsburgh to atlanta on us air,Flight
830,how long does the ground transportation take from the salt lake city airport,NoFlight
897,what does fare code qo mean,NoFlight
2985,what are the classes of service on delta airlines,NoFlight
4437,i would like one flight from kansas city to st. paul arriving around dinnertime 6 pm,Flight
264,show me all the flights from san francisco to boston for august thirty first 1991,Flight
3261,wednesday morning flights between baltimore and newark,Flight
1150,american flight 4400 from cincinnati to houston,Flight
3340,can you list flights departing from las vegas and arriving in san diego,Flight
3455,please show me flights from san francisco to dallas,Flight
2995,give me the flights from miami to new york using tower air,Flight
350,how far is it from salt lake city airport to salt lake city,NoFlight
649,what is the earliest flight leaving boston and arriving in atlanta on november seventh,Flight
3634,dallas to oakland monday,Flight
1002,i'm interested in flying from atlanta to boston i'd like to fly during breakfast,Flight
749,list flights from ontario california to orlando florida,Flight
3935,i need a flight from philadelphia to dallas,Flight
4272,please show me the flights from atlanta to denver,Flight
2040,show me ground transportation in boston,NoFlight
1359,show me the shortest flight from boston to denver which arrives in denver wednesday before noon,Flight
2690,please list only the flights from cleveland to dallas that leave before noon,Flight
3793,flight from denver to salt lake city,Flight
2669,show me the cheapest one way flight from atlanta to pittsburgh,Flight
5423,show me all flights from indianapolis to montreal,Flight
2477,i'd like the first flight in the morning from boston to washington,Flight
2736,please show me all round trip flights from burbank to tacoma,Flight
4231,which flights travel from nashville to tacoma,Flight
2598,i want to see the cheapest flights from denver to atlanta,Flight
2753,what is the fare on november seventh going one way from dallas to san francisco,Flight
5082,what flight do you have from atlanta to dallas on august twenty seventh in the morning,Flight
5316,san francisco to pittsburgh friday,Flight
5390,i'd like to see flights from pittsburgh to atlanta,Flight
4453,what is the first class fare on united flight 352 from denver to boston,Flight
401,show me the flights to love field from all other airports,Flight
4003,i need information on flight from atlanta to denver,Flight
3620,list all flights from minneapolis to long beach on saturday,Flight
4049,give me flights that arrive in baltimore from atlanta denver and pittsburgh,Flight
5037,what kind of aircraft does delta fly before 8 am on august second from boston to denver,NoFlight
741,shortest flight from ontario california to orlando florida,Flight
2980,list the alaska airline flights from burbank,Flight
1845,i would like a nonstop flight from philadelphia to pittsburgh,Flight
2449,show last flight from philadelphia to boston,Flight
3143,please list the thursday morning flights from st. louis to st. paul,Flight
103,find flights arriving new york city next saturday,Flight
4535,are there any airlines that have flights from boston to philadelphia that leave before 630 am,Flight
411,list all the flights that arrive at general mitchell international airport,Flight
2738,i want a flight round trip from memphis to seattle,Flight
2060,is there ground transportation in boston from the airport,NoFlight
1688,what nonstop flights between atlanta and washington leave atlanta after 6 o'clock pm,Flight
913,what is the meaning of fare code qx and qw,NoFlight
4140,what's a flight that goes from baltimore to seattle,Flight
4813,flight information from oakland to denver,Flight
5013,i'd like to go from long beach to st. louis and i'd like to stop in dallas i'd also like to have lunch during my flight,Flight
1373,what flights go from boston to atlanta next tuesday,Flight
2656,would you tell me the cheapest one way fare from boston to oakland,Flight
1162,what stops does dl 838 make from san francisco to atlanta,Flight
1828,what're the cheapest nonstop flights from new york to miami one way,Flight
2095,all northwest and united airlines flights with stopovers in denver,Flight
4173,i'd like to see the flights from pittsburgh to philadelphia,Flight
710,what time are flights from denver to san francisco on continental airlines,Flight
272,list the flights and time of arrival for flights arriving in dallas fort worth from boston before noon,Flight
300,show all flights and fares from pittsburgh to san francisco,Flight
4008,okay show me all the flights to baltimore,Flight
2757,what is the fare going one way on november seventh from denver to oakland,Flight
2228,is there any flight leaving washington around 3 o'clock for denver,Flight
3145,afternoon flight from denver to san francisco,Flight
486,what flights are available from dallas to atlanta with one way economy fares,Flight
1637,i want a flight on twa from boston to denver,Flight
770,what is the least expensive flight from baltimore to san francisco,Flight
1539,give me the flights with the fares from indianapolis to orlando on december twenty seventh,Flight
3772,show me flights from phoenix to fort worth,Flight
2968,list the fares of us air flights from boston to philadelphia,Flight
967,i want to find the first flight from baltimore to boston that serves a meal,Flight
4679,okay and then from pittsburgh i'd like to travel to atlanta on september fourth,Flight
4814,the flight will originate from boston,Flight
4983,what is the least expensive way to fly from philadelphia to san francisco,Flight
5452,can i have the fare .,Flight
1061,show me all flights from chicago to kansas city on thursday june seventeenth arriving in kansas city at around 7 o'clock in the evening,Flight
1650,is there a flight from baltimore to san francisco with a stop in denver on twa,Flight
1116,i'd like to take a flight from washington dc stop in denver and with my final destination as san francisco,Flight
235,show me all the eastern airlines flights leaving pittsburgh between 12 and 4 in the afternoon,Flight
3176,morning flight from oakland to dallas,Flight
667,how many first class flights does united have today,NoFlight
2990,list a flight on delta airlines from toronto to san diego,Flight
4604,i want a flight from atlanta to washington that leaves after 3 pm,Flight
2744,round trip flights between houston and las vegas,Flight
982,does delta aircraft fly dc10,NoFlight
4760,i want to go from san francisco to denver,Flight
1390,which round trip flights leave chicago next tuesday around 6 pm and arrive in detroit,Flight
2157,i want a flight from boston to denver that stops in pittsburgh,Flight
417,list all the flights that arrive at general mitchell international from various cities,Flight
1813,which airline offers the cheapest rate going from dallas to baltimore on july fourth,Flight
1187,what kind of plane flies from boston to pittsburgh after noon,NoFlight
3802,i'd like to fly from boston to san francisco,Flight
1917,i'd like a ticket on a plane from denver to atlanta i would like a coach class or lowest fare ticket,Flight
3090,is there an american airlines flight in the evening from dallas to san francisco,Flight
2942,show me fares leaving on tuesdays from denver to dallas,Flight
4206,i need information for flights leaving baltimore and arriving in atlanta,Flight
2061,i would like information on ground transportation in the city of atlanta from airport to downtown,NoFlight
4999,what is fare code m,NoFlight
3101,does united airlines have flights between boston and denver,Flight
1503,show me the flights from minneapolis to indiana,Flight
5439,please book a one way coach fare from Chicago to Indianapolis on United flight two ninety two next wednesday .,Flight
415,what flights land at general mitchell international,Flight
495,show me all economy prices from dallas to baltimore,Flight
4736,tampa to charlotte sunday morning,Flight
5492,please list costs of round trip fares from Denver to Atlanta .,Flight
708,what time is the last flight from washington to san francisco,Flight
5085,show me the flights from san francisco to boston on august thirty first,Flight
4539,please show me airlines with flights from philadelphia to dallas,NoFlight
4792,what flights from seattle to salt lake city,Flight
4693,give me fares from atlanta to baltimore,Flight
808,show me the least expensive flight from miami to new york on a sunday with first class fare,Flight
480,what economy flights are available from dallas to baltimore on december seventeenth,Flight
1358,what flights arrive in chicago on sunday on continental,Flight
2131,is there a flight from philadelphia to oakland with a stop in dallas,Flight
4187,what about the flights from boston to la,Flight
4973,is there limo service at pittsburgh airport,NoFlight
2603,what's the cheapest of the dallas to atlanta flights which are after 2 in the afternoon,Flight
912,what does fare code h mean,NoFlight
538,is there a round trip flight from baltimore to dallas connecting in denver,Flight
1237,could you tell me if there is ground transportation between the boston airport and boston downtown,NoFlight
1125,what aircraft is used on delta flight 1222 from kansas city to salt lake city,NoFlight
2070,information on ground transportation in denver,NoFlight
2624,what's the lowest round trip fare from dallas to any city,Flight
2793,show me round trip fares from san jose to salt lake city,Flight
2304,tell me about flights from toronto to salt lake city leaving after 530 pm,Flight
1399,please list available flights for next saturday from philadelphia to dallas,Flight
2220,find travel arrangements for a round trip flight from dallas to pittsburgh after 8 pm,Flight
2692,list the northwest airlines flights that leave denver before noon,Flight
3467,please show me flights from dallas fort worth to atlanta on monday,Flight
4743,show me all flights from san diego to los angeles,Flight
343,how far from the airport in the dallas fort worth airport is dallas,NoFlight
2345,give me the flights from new york city to nashville leaving after 5 pm on wednesday,Flight
639,what is the latest afternoon flight departing san francisco and arriving in boston on november ninth,Flight
2277,are there any flights before 12 noon on june fifteenth from long beach to columbus,Flight
1367,show me all flights from phoenix to milwaukee next wednesday,Flight
164,flight numbers from columbus to minneapolis tomorrow,Flight
4182,show me flights from atlanta to baltimore denver and dallas,Flight
2213,ground transportation from airport in boston to downtown boston,NoFlight
3296,what flights are available tuesday afternoon from pittsburgh to atlanta,Flight
218,where is lester pearson airport,NoFlight
4918,ground transportation atl to atlanta,NoFlight
2240,what american airlines flights from phoenix to milwaukee depart phoenix after 6 pm on wednesday,Flight
198,list all flights arriving in denver between 8 and 9 pm,Flight
4093,list the flights from dallas to baltimore,Flight
861,i want to fly from milwaukee to orlando on either wednesday evening or thursday morning,Flight
62,all flights from boston to washington dc after 5 pm on november eleventh economy class,Flight
3310,from las vegas to phoenix departing in the morning,Flight
4642,i would like to book a flight from denver to pittsburgh on july fifteenth i'd like it to be the cheapest flight,Flight
522,i would like to find a flight that goes from boston to orlando i would like it to have a stop in new york and i would like a flight that serves breakfast,Flight
183,show me the car rentals in baltimore,NoFlight
120,i want a flight from philadelphia to dallas that at least has one stop,Flight
4677,i'd like a flight on july ninth from orlando to kansas city in the afternoon,Flight
1961,show me the flights from st. petersburg to salt lake city that arrive before noon,Flight
4476,show me the flights on continental from indianapolis to san diego in the afternoon tomorrow,Flight
4246,show me the flights from pittsburgh to baltimore,Flight
1462,show me flights from denver to washington dc on a wednesday,Flight
3754,flights from montreal and phoenix to las vegas,Flight
1232,is there ground transportation from the dallas airport to downtown dallas,NoFlight
4930,what flights from any city land at general mitchell international,Flight
4316,what is the earliest flight from boston to bwi that serves a snack,Flight
457,what is the seating capacity for aircraft l10,NoFlight
4518,i'd like a twa flight from las vegas to new york nonstop,Flight
5338,what are the american flights from newark to nashville,Flight
4359,baltimore to kansas city economy,Flight
5178,okay i'd like a flight from boston to san francisco that leaves before 8 am,Flight
3335,flights from kansas city to cleveland on wednesday,Flight
4393,in pittsburgh i'd like to rent a car,NoFlight
382,what is the aircraft type with the greatest seating capacity,NoFlight
4020,could you show me all flights from montreal to charlotte,Flight
3494,please find a flight from st. petersburg to miami on thursday,Flight
1783,which airlines are represented in the database,NoFlight
570,on august thirtieth i would like a flight from denver to san francisco in the early am,Flight
3008,i would like a flight from philadelphia to dallas on american airlines,Flight
3191,show me wednesday afternoon flights from denver to san francisco,Flight
987,show me all flights from san diego to new york using dc10,Flight
254,please find a flight round trip from los angeles to tacoma washington with a stopover in san francisco not exceeding the price of 300 dollars for june tenth 1993,Flight
432,flights from baltimore to philadelphia where the round trip fare is less than 1000 dollars,Flight
1881,information on round trip flights from pittsburgh to san francisco first class,Flight
2727,could you please give me the cost of a round trip flight from denver to pittsburgh,Flight
1651,flights on twa from columbus to st. louis,Flight
2414,list the earliest flights from st. paul to houston,Flight
1896,show me flights first class from san francisco to pittsburgh leaving on tuesday after 8 o'clock in the morning and before 12 noon,Flight
3347,what flights are available monday from san francisco to pittsburgh,Flight
339,what is the distance from los angeles international airport to los angeles,NoFlight
1596,what does ea mean,NoFlight
1411,give me the round trip flights from cleveland to miami next wednesday,Flight
2782,list a round trip fare from kansas city to minneapolis flights,Flight
2272,i need a flight on thursday before 8 am from oakland to salt lake city,Flight
5186,us air flights departing from charlotte around 1 pm,Flight
4752,do you have flights from st. petersburg to toronto on monday,Flight
2853,show me the flights from boston to denver on august second,Flight
134,give me the flights from memphis tennessee to charlotte north carolina,Flight
2879,show me all flights between san francisco and philadelphia for september fifteenth,Flight
3021,show me the flights from boston to san francisco on united airlines,Flight
2783,show me the round trip tickets from baltimore to dallas,Flight
657,what is the earliest flight departing san francisco and arriving in boston on november ninth,Flight
654,i need to get from cincinnati to denver on june sixth by 6 pm,Flight
5459,what is e w r .,NoFlight
745,please list any flight available leaving oakland california tuesday arriving philadelphia wednesday,Flight
972,very well i'm working on scenario three i'm interested in a flight on a 727 from washington dc to atlanta georgia,Flight
3252,memphis to las vegas sunday afternoon,Flight
5056,list nonstop flights from los angeles to pittsburgh which arrive on monday after 5 pm,Flight
297,show me all flights and fares from denver to san francisco,Flight
4770,please list all flights between boston and philadelphia operating on sundays,Flight
4135,show me flights from atlanta to baltimore,Flight
2893,what are the flights from charlotte to atlanta returning on tuesday july thirteenth,Flight
2294,what flights go from newark to boston after 5 pm,Flight
4037,what flights are there from tampa to charlotte,Flight
1999,what is the ground transportation available in boston,NoFlight
5514,how far is the airport from New York 's la guardia to downtown .,NoFlight
4122,flights from newark to boston,Flight
226,show me city served both by nationair and canadian airlines international,NoFlight
2171,show me the flights that go from san diego to newark by way of houston,Flight
4702,i'd like a flight from new york to los angeles on saturday morning on us air,Flight
2137,i'd like to fly from philadelphia to san francisco with a stopover in dallas,Flight
1430,which airlines fly from boston to washington dc via other cities,NoFlight
4511,list all round trip flights between indianapolis and orlando on the twenty seventh of december,Flight
1829,find nonstop flights from salt lake city to new york on saturday april ninth,Flight
1494,flight from dallas to oakland california on monday,Flight
3951,what are all the flights into atlanta's airport,Flight
2154,is there a round trip flight from atlanta to dallas via denver,Flight
979,i am interested in a flight on an aircraft number 727 i would like to go from washington to atlanta,Flight
568,show me flights from boston to denver early am on tuesday,Flight
3376,how about flights leaving san francisco and arriving in boston for any day,Flight
4570,what kind of ground transportation is there in dallas,NoFlight
4644,can you show me the cheapest round trip flights between denver and pittsburgh,Flight
11,show me the ground transportation schedule in philadelphia in the morning on wednesday,NoFlight
3818,what flights go to san francisco from boston,Flight
556,is there a direct flight from denver to pittsburgh in the morning of august thirty first that is nonstop,Flight
5334,are there delta flights leaving atlanta,Flight
1763,what airlines fly from new york to milwaukee to los angeles,NoFlight
1239,do you have the fare for traveling from oakland airport to oakland downtown,NoFlight
4463,what airplane types fly from pittsburgh to baltimore,NoFlight
533,is there an atlanta flight to denver connecting,Flight
2279,show me flights from milwaukee to orlando on wednesday after 6 pm,Flight
3148,show the flights from milwaukee to orlando on a thursday morning,Flight
4166,i need a flight from boston to denver,Flight
3037,i want to fly united airlines from boston to denver,Flight
2960,fares from dallas to baltimore,Flight
1271,give me the earliest flight on american airlines tomorrow from st. petersburg to milwaukee,Flight
751,list flights from ontario california to orlando,Flight
3322,list early morning flights from cincinnati to tampa,Flight
780,what is the least expensive flight from atlanta to boston,Flight
5438,what flights are available between Chicago and Indianapolis next wednesday between eleven a.m. and one p.m .,Flight
2486,what's the latest flight from san francisco to atlanta,Flight
2024,what ground transportation is available in newark,NoFlight
1308,what's the cheapest flight from san francisco to detroit today,Flight
4617,what is the earliest flight from pittsburgh to san francisco,Flight
815,what ground transportation is available at the boston airport,NoFlight
4864,show me all flights from atlanta to denver which leave after 5 o'clock pm the day after tomorrow,Flight
4312,what does the restriction ap58 mean,NoFlight
71,flights from denver to baltimore between 10 am and 2 pm,Flight
2920,show me fares from philadelphia to san francisco on thursday morning,Flight
3476,show flights from san francisco to denver on wednesday and thursday,Flight
3656,show me the flights from boston to pittsburgh on wednesdays and thursdays,Flight
572,i would like to travel from boston to denver early in the morning,Flight
5337,does lufthansa fly between boston and oakland,Flight
1882,how much is a first class round trip from atlanta to san francisco,Flight
1657,find travel arrangements for a round trip flight from dallas to pittsburgh arriving after 8 pm,Flight
3087,give me the american airlines flights from phoenix to milwaukee on wednesday,Flight
5510,please show me all flights from Montreal to Las Vegas .,Flight
5083,okay just on november twenty third i want to fly from atlanta to denver and i need to know what flights are available,Flight
4281,show me ground transportation in philadelphia on monday morning,NoFlight
4963,how many cities are served by delta airlines with first class flights,NoFlight
1992,what is the cheapest coach fare from dallas to denver round trip,Flight
2639,what is the cheapest round trip fare from pittsburgh to atlanta,Flight
3409,show me all flights from san francisco to boston philadelphia or baltimore,Flight
689,how many cities are served by continental with first class flights,NoFlight
2453,what is the earliest morning flight leaving boston for washington,Flight
4985,what is the ground transportation between the charlotte airport charlotte airport and downtown charlotte,NoFlight
4721,now i need a flight from detroit to san diego leaving tuesday evening,Flight
1070,is there an airline that services boston dc and dallas,NoFlight
5195,show first flight from boston to philadelphia,Flight
336,how far is new york's la guardia from downtown,NoFlight
1447,show me round trip fares between san francisco and washington dc,Flight
2515,what is the earliest flight from memphis to las vegas,Flight
4322,how much does the limousine service cost within pittsburgh,NoFlight
2621,what is the cheapest fare one way between pittsburgh and denver,Flight
3582,show me flights from dallas to atlanta on tuesday,Flight
5386,i need a flight from tampa to milwaukee,Flight
3327,what are the early morning flights from boston to denver,Flight
1166,show me northwest flight 608 from kansas city to st. paul,Flight
5325,from san francisco to denver,Flight
4073,could you please list all of the classes of flights there are,NoFlight
313,what does dfw mean,NoFlight
4421,what does the fare code yn mean,NoFlight
2119,all united airlines flights with stopovers in denver,Flight
