id,tokens,intent
595,i'd like a flight from baltimore to boston as early in the morning as i can,Flight
948,does flight ua 270 from denver to philadelphia have a meal,Flight
2807,on the flight from baltimore to san francisco on us air leaving at 420 what type of aircraft is used,NoFlight
968,do you have a 747 that flies from san francisco to baltimore,Flight
1434,give me information on flights from atlanta to washington dc leaving on thursday before 0900,Flight
3325,i would like to fly from st. paul to san jose monday morning from san jose to houston tuesday morning and from houston to st. paul on wednesday morning,Flight
4858,i want to fly from atlanta to philadelphia,Flight
905,what round trip flights between atlanta and denver qualify for fare code qx,Flight
412,i'd like a flight from cincinnati to newark airport that arrives on saturday before 6 pm,Flight
5410,is there a flight leaving from boston to atlanta,Flight
5425,what are the flights from boston to washington,Flight
1761,which airlines fly from toronto to san diego and have a stopover in denver,NoFlight
3636,list flights from philadelphia to san francisco thursday,Flight
4907,please list all flights from dallas to pittsburgh on july fourth 1991,Flight
4138,how do you get from the airport to downtown dallas please,NoFlight
4942,i would like to find a flight that goes from tampa to montreal making a stop in new york and a flight that serves lunch,Flight
3170,flights from dallas to houston in the morning,Flight
2478,what is the earliest flight from boston to dallas fort worth leaving august eighth,Flight
4300,what is restriction ap 80,NoFlight
838,what is the ground transportation in san diego,NoFlight
1735,what airlines fly from boston to washington,NoFlight
1669,show flights from cleveland to miami that arrive before 4 pm,Flight
3911,please list flights from milwaukee to philadelphia,Flight
4637,what is the cheapest round trip fare between boston and san francisco,Flight
3049,i'd like to fly continental airlines between boston and philadelphia,Flight
5432,i need a flight from Charlotte to Las Vegas that makes a stop in Saint Louis .,Flight
3672,flights from boston flights from philadelphia to boston on monday,Flight
3338,all flights from san francisco to los angeles,Flight
2447,what is your earliest morning flight from indianapolis to charlotte,Flight
9,show me the flights on american airlines which fly from st. petersburg to ontario canada with a stopover in st. louis,Flight
5427,show me the flights between houston and orlando,Flight
2239,i'm looking for flights from oakland to atlanta leaving before 1045 am,Flight
5068,show me the latest nonstop flight from denver to washington dc,Flight
89,list all day time flights from pittsburgh to boston,Flight
2550,what is the cheapest one way fare between boston and oakland,Flight
1258,is there ground transportation from san diego airport to the downtown area,NoFlight
4740,show me the flights from san francisco to dallas,Flight
3978,okay can you tell me the flight cost between denver and atlanta,Flight
2773,round trip flights from orlando to montreal please,Flight
1991,how much is coach flight from pittsburgh to atlanta,Flight
1715,which flights depart from new york and arrive in los angeles after 10 am,Flight
1708,show me the cheapest round trip between st. petersburg and detroit that arrives before 7 pm,Flight
4934,what is the seating capacity for the aircraft m80,NoFlight
1413,which flights leave chicago next tuesday and arrive in detroit around 6 pm,Flight
384,which airline has more business class flights than any other airline,NoFlight
1085,what flights are there between washington dc and columbus ohio,Flight
1664,are there any nonstop flights from philadelphia to denver that arrive before 5 pm,Flight
5232,what flights go from boston to pittsburgh after 1205 in the afternoon,Flight
5519,what flights leave Los Angeles arriving in Minneapolis .,Flight
3031,list all afternoon flights on united airlines from san francisco to denver,Flight
507,are there any flights from boston to orlando connecting in new york,Flight
4848,tell me about flights from indianapolis to houston,Flight
2765,could you please give me the round trip fare from denver to atlanta,Flight
885,i would like a list of the round trip flights between indianapolis and orlando on the twenty seventh or the twenty eighth of december,Flight
2238,find the flights leaving dallas and going to san francisco that leave after 5 pm,Flight
1112,how many northwest flights leave washington dc,Flight
4631,what's the earliest flight from dallas to houston,Flight
4730,what flights are there from boston to denver on monday morning,Flight
2364,list flights from tampa to cincinnati after 3 pm,Flight
512,is there a flight from boston to san francisco making a stopover in dallas fort worth,Flight
3281,list flights from chicago to kansas city in the morning,Flight
3723,show the flights from denver to san francisco,Flight
5308,what are the afternoon flights between washington and boston,Flight
3604,show me some information on making a reservation from philadelphia to denver on sunday,Flight
2506,i'd like a cheap flight from dallas to baltimore on january first,Flight
1372,which flights leave newark after noon next saturday and arrive in los angeles,Flight
2685,list flights from cincinnati to tampa before noon,Flight
3660,show me the flights from boston to pittsburgh on thursday,Flight
3508,does continental fly from denver to san francisco,Flight
3419,please show me continental flights from san francisco to pittsburgh on friday,Flight
5372,find me a flight from cincinnati to any airport in the new york city area,Flight
4764,all delta flights to everywhere if you can,Flight
2232,i need a flight from salt lake city to phoenix departing wednesday after 5 pm,Flight
2051,in atlanta i would like information on ground transportation,NoFlight
5033,i would like a to know the type of aircraft leaving from atlanta bound to boston on friday this week,NoFlight
1369,philadelphia to san francisco next week tuesday show the flights,Flight
3316,flight from denver to philadelphia saturday afternoon,Flight
1641,what airline is ea,NoFlight
1778,does any airline have an afternoon flight from atlanta to boston,NoFlight
2176,i want to go from baltimore to san francisco with a stopover in denver,Flight
4224,show me the flights that go from tacoma to miami,Flight
332,what is bur,NoFlight
1398,okay on the following wednesday i'd like to go from memphis to cincinnati as early as possible,Flight
4347,show me flights from all airports to love field,Flight
1980,what are the coach fares for flights from newark to la leaving after 3 pm,Flight
2291,show me all flights from dallas to pittsburgh on monday which leave after 8 o'clock pm,Flight
2549,cheapest flight from miami to indianapolis,Flight
3984,please list the flights from charlotte to newark,Flight
1427,what is american's last flight from boston to washington dc on july twenty first,Flight
4337,how long does a flight from baltimore to san francisco take,Flight
3123,show afternoon flights from houston to dallas,Flight
2568,what's the cheapest flight from denver to pittsburgh for both one way and round trip flights,Flight
3663,i'm in miami and i'd like to travel to las vegas on sunday,Flight
1111,from washington dc to philadelphia departing in the afternoon,Flight
2718,what northwest airlines flights leave denver before noon,Flight
2075,what types of ground transportation are available in philadelphia,NoFlight
433,round trip fares from denver to philadelphia under 1000 dollars,Flight
3103,i would like to fly on american airlines from baltimore to san francisco,Flight
1283,i'd like a flight tomorrow from columbus to houston with a stopover in nashville,Flight
4154,what are the flights from denver to oakland,Flight
3713,on tuesday i'd like to fly from detroit to st. petersburg,Flight
1925,what is the fare from philadelphia to pittsburgh business class one way,Flight
1216,what type of aircraft is used on the first flight from philadelphia to dallas in the morning,NoFlight
5246,i would like an afternoon flight from washington to boston on august twentieth,Flight
2405,what's the first flight from dallas to houston,Flight
2012,what ground transportation is available in pittsburgh,NoFlight
3764,list flights from phoenix to las vegas,Flight
1610,show me all the flights on delta airlines and twa that go to atlanta in the morning,Flight
4838,show flights from dallas to oakland,Flight
4021,i need to go from boston to dallas,Flight
2721,could i have a listing of flights leaving boston going to baltimore leaving wednesday after 2100,Flight
2106,the flights from ontario to westchester that stop in chicago,Flight
836,show me ground transportation information for san francisco,NoFlight
5509,how much does a first class round trip ticket from Detroit to Saint Petersburg cost .,Flight
2683,list flights from oakland to salt lake city leaving after midnight thursday,Flight
4726,i need to fly from pittsburgh to oakland and depart in the afternoon,Flight
5470,i 'd like to fly out of Chicago for less than a hundred fifty dollars round trip .,Flight
1053,i want a nonstop flight from indianapolis to toronto that leaves thursday morning,Flight
1792,what airlines fly from boston to san francisco,NoFlight
2962,what is the price of flights from indianapolis to memphis,Flight
2780,all one way flights between boston and philadelphia,Flight
5389,show me the flights from boston to pittsburgh,Flight
2032,what ground transport is available in baltimore,NoFlight
1361,i need a flight leaving pittsburgh next monday arriving in fort worth before 10 am,Flight
5092,okay does twa have a flight from dallas to san francisco,Flight
1475,show me the flights from san diego to washington dc,Flight
606,i want the list of daily flights from milwaukee to st. louis,Flight
4268,show me the flights from denver that go to pittsburgh and then atlanta,Flight
4222,show me flights leaving from dallas to baltimore,Flight
5034,show me the type of aircraft that cp uses,NoFlight
1185,show me the aircraft that canadian airlines uses,NoFlight
569,i want to go between boston and washington early in the morning,Flight
2317,what flights go from san francisco to boston and leave after 1 o'clock,Flight
3468,i need a flight from new york to san francisco,Flight
2636,please give me the cheapest flight from denver to pittsburgh,Flight
2194,i want to go from denver to atlanta round trip and make a stop at pittsburgh may i have the cheapest fare,Flight
4074,what flights depart from baltimore,Flight
494,okay i need to see economy flights on united between dallas and baltimore,Flight
214,does eastern airlines fly early in the morning between logan and bwi,Flight
1409,i need a return flight from chicago to kansas city leaving chicago around 7 in the evening on the day following next wednesday,Flight
4064,what are the flights from atlanta to dallas,Flight
4798,what flights do you have leaving boston going to san francisco,Flight
1587,what is the code for business class,NoFlight
2945,what are the prices of the flights from dallas to baltimore,Flight
5369,all right now i need a flight from seattle to san diego,Flight
2472,can you give me the latest flight from atlanta to denver on july seventh,Flight
4168,when do planes leave boston for,Flight
3755,flights from phoenix to las vegas,Flight
2115,i would like to fly from denver to atlanta by way of pittsburgh,Flight
1803,tell me which airlines have flights from pittsburgh to san francisco on monday september second,Flight
540,show me the direct flights from charlotte to minneapolis on tuesday morning,Flight
576,i would like to fly to san francisco early in the day,Flight
2078,ground transportation in dallas and boston,NoFlight
3194,i would like information on flights leaving atlanta in the afternoon arriving in dallas,Flight
1528,i would like to book a flight on us air first class from cleveland to miami on february twenty fourth,Flight
5153,what flights go from boston to san francisco with a stop in dallas,Flight
2468,i'd like to know the shortest trip between boston and san francisco,Flight
3833,i would like to book a flight that goes from memphis to las vegas,Flight
1612,show me the cheapest round trip coach fare on twa from las vegas to detroit,Flight
1954,show me all flights out of boston on june twentieth that have business class,Flight
1604,what does the abbreviation co mean,NoFlight
4439,list nonstop flights from baltimore washington airport to oakland that depart in the afternoon,Flight
4731,give me morning flights from atlanta to baltimore,Flight
4577,show me information on ground transportation for dallas,NoFlight
4457,what first class airplane goes from philadelphia to san francisco and stops in dallas in the afternoon on monday,Flight
5512,i need a first class round trip airfare from Detroit to Saint Petersburg .,Flight
1328,i need flight information leaving atlanta and arriving in baltimore for monday,Flight
615,list possible round trip daily flights between boston and oakland,Flight
5434,what is the cheapest one way flight from Columbus to Indianapolis .,Flight
999,on a breakfast flight from philadelphia to dallas via atlanta,Flight
4879,flights from pittsburgh to baltimore between 10 am and 2 pm,Flight
215,what flights are there on wednesday evening from denver to sfo,Flight
428,show me all flights from new york to miami on a tuesday with round trip fare less than 932 dollars,Flight
4324,can you tell me the flights on october fifteenth 1991 from boston to oakland,Flight
3238,what are the flights available in the morning between denver and san francisco,Flight
1456,from atlanta to washington dc,Flight
2054,what kind of ground transportation is available in atlanta,NoFlight
1608,what is airline ff,NoFlight
2766,one way,Flight
4738,what pm flights are available from philadelphia to pittsburgh,Flight
2495,what is the last flight from dallas to boston,Flight
1094,find a flight from washington dc to san francisco on tuesday,Flight
4185,sure i want to go from philadelphia to dallas,Flight
3611,requesting flight information for flight from boston to baltimore on tuesday,Flight
3383,show me flights from los angeles to pittsburgh for tuesday,Flight
2748,can you show me what fares are available from oakland to dallas on december sixteenth one way only,Flight
4161,list all flights from pittsburgh to philadelphia,Flight
1827,round trip houston to las vegas nonstop,Flight
1034,i want to fly from miami to chicago on american airlines and arrive at around 5 o'clock in the afternoon show me all flights,Flight
4882,what is the earliest arriving flight from houston to orlando,Flight
2461,what's the latest flight i can get from dallas to boston,Flight
4578,i would like an american flight from toronto to san diego with a stopover in denver please,Flight
3024,what flights from milwaukee to san jose on wednesday on american airlines,Flight
1951,i'd like to buy a coach class ticket from denver to atlanta with a stopover in pittsburgh,Flight
1006,show me the cheapest flight from pittsburgh to atlanta on wednesday which leaves before noon and serves breakfast,Flight
4011,i would like flights from ontario to tacoma,Flight
1694,find travel arrangements for a round trip flight from dallas to pittsburgh arriving after 8 pm before 10 pm,Flight
1701,show me all flights from pittsburgh to oakland that arrive after 10 am,Flight
3868,i need information on a flight from boston to denver,Flight
1255,list all the arriving flights at general mitchell international,Flight
2436,what's the earliest flight i can get between boston and dallas,Flight
611,list daily flights from oakland to boston using twa,Flight
93,i'd like a red eye flight from new york to los angeles on saturday evening on us air,Flight
4047,show me all flights from denver to baltimore,Flight
5311,baltimore to newark wednesday morning,Flight
2982,where does canadian airlines international fly,NoFlight
1009,what is the earliest breakfast flight from philadelphia to fort worth,Flight
1148,what is the round trip fare on continental 1291 from denver to san francisco and return,Flight
5264,please give me fares from denver to philadelphia,Flight
2582,cheapest fare from memphis to seattle,Flight
4543,show me nonstop flights from toronto to st. petersburg,Flight
4712,what flights are available wednesday afternoon from denver to san francisco,Flight
2314,show me flights from seattle to san francisco that leave after 5 pm,Flight
3408,show me all flights from san francisco to pittsburgh on a monday,Flight
2570,i'd like to book the cheapest flight from atlanta to denver on august first,Flight
3650,sunday's flights between tampa and charlotte,Flight
3583,okay how about a flight on sunday from tampa to charlotte,Flight
646,please list the flights from pittsburgh to baltimore arriving may seventh,Flight
4116,i need a return flight from philadelphia to boston,Flight
3884,please list all flights from baltimore to atlanta,Flight
531,i need a connecting flight on continental on june fifth from chicago to seattle,Flight
5052,list all us air flights arriving in charlotte on saturday at 1 pm,Flight
650,what is the earliest united airlines flight flying from denver to baltimore and arriving on july fourth,Flight
1728,what airlines fly from boston to pittsburgh,NoFlight
4747,i am also interested in a flight that runs from st. louis to las vegas,Flight
593,give me a combination of continental flights from chicago to seattle that have meals early saturday morning,Flight
2511,find me the earliest flight from boston to atlanta,Flight
3099,i'm trying to make a connection between denver and san francisco does delta airline fly between those two,Flight
2382,i would like an early flight from la to charlotte monday morning,Flight
3631,find flight from phoenix to detroit on monday,Flight
4754,show flights from st. petersburg to charlotte,Flight
1451,give me information on flights from atlanta to washington dc on wednesday after 4 pm and thursday before 9 am,Flight
1988,all round trip flights between new york and miami coach fare,Flight
1067,i would like a nonstop flight between pittsburgh and philadelphia leaving in the afternoon and arriving in the vicinity of 5 pm,Flight
1661,find a flight between st. petersburg and charlotte the flight should leave in the afternoon and arrive as soon after 5 pm as possible it should be a nonstop flight,Flight
766,i want a flight from montreal quebec to san diego california that leaves sunday,Flight
151,how do i get from bwi to washington,Flight
5491,please list flights departing from Toronto Canada to Washington on saturday .,Flight
337,how long does it take to get from kansas city to st. paul,NoFlight
2201,is there ground transportation from the airport to downtown phoenix,NoFlight
4015,list flights from dallas to houston,Flight
2545,what is the cheapest fare between denver and boston,Flight
4744,show flights from kansas city to minneapolis,Flight
2918,price of flight from cleveland to nashville,Flight
1130,what type of aircraft is used on american airline flight 315,NoFlight
1541,what is your last trip on august twenty seventh from washington to boston,Flight
1498,what do you have on monday from dallas fort worth to oakland california,Flight
3862,show me the flights from chicago to indianapolis,Flight
625,list daily flights from boston to oakland using twa,Flight
2161,i would like a flight leaving from boston arriving in san francisco with a stopover in atlanta,Flight
1939,minneapolis to pittsburgh first class flight,Flight
4335,how far is toronto international from downtown,NoFlight
3598,list flights from milwaukee to san jose on wednesday,Flight
2851,i would like an early morning flight on june first from chicago into seattle on continental airlines,Flight
5275,is there a flight on united airlines from boston to denver,Flight
4560,show me one way flights from tampa to st. louis departing before 10 am first class,Flight
3529,are there any flights from chicago to minneapolis on saturday on continental,Flight
20,what is the ground transportation available in fort worth texas,NoFlight
5288,give me a list of the morning flights from atlanta to boston,Flight
3591,could you list for me the flights that leave oakland on sunday and arrive in dallas,Flight
2848,give me the flights leaving denver august ninth coming back to boston,Flight
673,how many canadian airlines international flights use aircraft 320,NoFlight
934,describe fare code qx,NoFlight
5177,hello i'm trying to find a flight that goes from pittsburgh to denver after 2 pm,Flight
4380,show me the flights arriving in baltimore on june fifteenth leaving either from denver or dallas,Flight
2952,show me fares from baltimore to philadelphia,Flight
5070,show me flights denver to washington dc on thursday,Flight
158,what is the flight number for the continental flight which leaves denver at 1220 pm and goes to san francisco,Flight
3866,i would like to travel from boston to denver,Flight
172,can i have a rental car in houston,NoFlight
4389,what time does the tuesday morning 755 flight leaving washington arrive in san francisco,Flight
4815,what are the flights from pittsburgh to oakland,Flight
2409,need an inexpensive flight from baltimore to san francisco,Flight
1533,i'm trying to find a flight from kansas city to burbank on saturday the twenty second,Flight
4120,i'd like to fly from boston to baltimore,Flight
5063,give me the fares from miami to cleveland next sunday,Flight
3804,i would like a flight from philadelphia to san francisco,Flight
5206,what is the earliest flight from washington to atlanta leaving on wednesday september fourth,Flight
4455,does flight dl 1083 from philadelphia to denver fly on saturdays,Flight
4756,show me all flights from san francisco to pittsburgh on friday,Flight
2983,what are the classes of service for american airlines,NoFlight
1905,what is the latest first class flight of the day leaving dallas for san francisco,Flight
2454,what is the last flight from washington to boston,Flight
3763,what flights do you have from baltimore to san francisco,Flight
5145,what kind of ground transportation is there once i get to dallas,NoFlight
3249,what flights are available friday afternoon from pittsburgh to san francisco,Flight
4061,show me all the flights from baltimore to columbus,Flight
2210,what ground transportation is available from pittsburgh to downtown,NoFlight
2812,list all the flights from atlanta to philadelphia on august the first,Flight
4374,i would like to find flights from columbus to minneapolis on monday june fourteenth early in the morning or in the evening sunday june thirteenth thank you,Flight
1136,on eastern flight 825 from atlanta to denver can you tell me what type of aircraft used before 12 noon,NoFlight
3116,what flights does american airlines fly from philadelphia to dallas,Flight
1745,please show me airlines with flights from denver to boston with stop in philadelphia,Flight
1741,do the airlines still offer first class,NoFlight
2847,i need to book a flight from newark to tampa on april fourth,Flight
3906,do you have any flights from chicago to indianapolis,Flight
5400,what are the flights from boston to baltimore,Flight
439,show me all flights from atlanta to dallas round trip less than 1100 dollars,Flight
1592,explain the fare codes,NoFlight
3813,show me the flights between boston and san francisco denver and san francisco boston and denver,Flight
715,what are the schedule of flights from boston to san francisco for august first,Flight
4739,what are the flights from milwaukee to orlando on wednesday night,Flight
55,show me ground transportation in washington dc,NoFlight
398,what flights arrive at love field on june sixth,Flight
5236,i want a round trip fare from new york to san jose,Flight
1183,what type of aircraft does eastern fly from atlanta to denver before 6 pm,NoFlight
3738,i would like to see flights from cincinnati to salt lake city,Flight
2485,i need a late flight from san francisco to boston on wednesday,Flight
4933,show me the flights from dallas to baltimore with a fare of 415 dollars,Flight
4479,show me the flights from los angeles to pittsburgh which arrive at pittsburgh on monday,Flight
3638,requesting flight information from boston to denver on wednesday,Flight
4069,show me the flights from baltimore to pittsburgh,Flight
4059,what are the flights from atlanta to baltimore,Flight
4733,morning flights from pittsburgh to atlanta on wednesday,Flight
5474,what is the cheapest first class ticket available flying from New York to Miami one way but also round trip .,Flight
3124,give me flights from chicago to seattle on saturday morning,Flight
4095,show me flights from montreal to orlando,Flight
3410,what flights from las vegas to san diego,Flight
5022,give me the flights from washington dc to philadelphia for december second,Flight
825,is there ground transportation available at the phoenix airport,NoFlight
1931,i would like a coach class seat on a flight leaving denver arriving atlanta,Flight
4742,from las vegas to phoenix,Flight
1486,i'd like to get a flight leaving san francisco and arriving at philadelphia pennsylvania,Flight
1648,what does the airline code dl stand for,NoFlight
1401,show me all flights from denver to philadelphia which leave next saturday afternoon,Flight
2371,i would like to know flights on june fifteenth from long beach to columbus after 12 noon please,Flight
4484,i'd like a flight from st. petersburg to miami on that next thursday,Flight
1994,ground transportation in phoenix,NoFlight
4967,list the number of flights leaving boston for dallas fort worth before 9 am in the morning,Flight
3485,show me flights between new york city and las vegas,Flight
496,i would like to see the economy fares for pittsburgh to philadelphia,Flight
2713,what flights go from newark to boston after 1024 in the morning,Flight
1437,all flights from boston to washington dc on november tenth,Flight
